{
  "id": "mo_w11",
  "name": "office-box",
  "base_image": "win11-24h2",
  "arch": "x86_64",
  "size": {
    "vcpus": 2,
    "ram_mb": 8192,
    "disk_gb": 80
  },
  "timezone": "asia/kolkata",
  "path_tools": [
    "git"
  ],
  "apps": [
    {
      "recipe_id": "clipchamp",
      "order_type": "native"
    },
    {
      "recipe_id": "figma",
      "order_type": "pwa"
    }
  ],
  "agent_bridge": {
    "expose": [
      "ssh"
    ],
    "egress": "on",
    "ssh_user": "spawn",
    "ssh_password": "set-at-build"
  }
}
